{
  "schema_version": 1,
  "id": "validation-properties-positive-infinity",
  "description": "The positive_infinity runtime properties recipe fails locally before any request.",
  "kind": "validation",
  "operation": {
    "name": "custom_event",
    "event_key": "runtime-properties",
    "event": {
      "email": "person@example.com"
    },
    "properties_recipe": "positive_infinity"
  },
  "expect": {
    "result": "validation_error",
    "attempts": 0
  }
}
