{
  "schema_version": 1,
  "id": "success-body-interrupted",
  "description": "A 200 whose body read fails is a known-outcome decode error and is never retried.",
  "kind": "success",
  "operation": {
    "name": "order_paid",
    "amount": 125.75,
    "currency": "IDR",
    "event": {
      "email": "buyer@example.com",
      "properties": {
        "order_id": "ord-paid"
      }
    }
  },
  "responses": [
    {
      "status": 200,
      "body": "{\"success\":tr",
      "disconnect_after_headers": true
    }
  ],
  "client": {
    "retry_count": 2
  },
  "expect": {
    "result": "response_decode_error",
    "attempts": 1,
    "delivery_outcome_unknown": false,
    "request": {
      "path": "/api/events/ingest",
      "authorization": "Bearer conformance-token",
      "payload": {
        "event_key": "order_paid",
        "is_common": true,
        "email": "buyer@example.com",
        "properties": {
          "order_id": "ord-paid",
          "amount": 125.75,
          "currency": "IDR"
        }
      }
    }
  }
}
