{
  "schema_version": 1,
  "id": "cancellation-before-request",
  "description": "Cancellation before dispatch sends no request.",
  "kind": "cancellation",
  "operation": {
    "name": "order_paid",
    "amount": 125.75,
    "currency": "IDR",
    "event": {
      "email": "buyer@example.com",
      "properties": {
        "order_id": "ord-paid"
      }
    }
  },
  "responses": [
    {
      "status": 200,
      "body": "{\"success\":true,\"data\":{\"success\":true,\"message\":\"accepted\",\"event_key\":\"order_paid\",\"validated_properties\":[\"order_id\"]}}"
    }
  ],
  "applicability": {
    "requires_capabilities": [
      "caller_cancellation"
    ],
    "inapplicable_languages": [
      "php",
      "ruby"
    ]
  },
  "cancellation": {
    "phase": "before_request"
  },
  "client": {
    "retry_count": 2
  },
  "expect": {
    "result": "caller_cancelled",
    "attempts": 0,
    "delivery_outcome_unknown": false
  }
}
