{
  "schema_version": 1,
  "id": "validation-order-created-blank-currency",
  "description": "order_created requires a nonblank currency argument.",
  "kind": "validation",
  "operation": {
    "name": "order_created",
    "amount": 125.75,
    "currency": " \t ",
    "event": {
      "email": "buyer@example.com"
    }
  },
  "expect": {
    "result": "validation_error",
    "attempts": 0
  }
}
